ticker,time_published,news_date,price_date,Open,High,Low,Close,_1,title,summary,source,source_domain,overall_sentiment_score,overall_sentiment_label,event_label
GOOGL,2025-03-25 03:55:22,2025-03-25,2025-03-24,167.07000732421875,168.32000732421875,165.13999938964844,167.67999267578125,289,Google’s landlord lists tech firm’s Venice campus for sale,"Net Lease Office Properties, a spin-off of W.P. Carey, is listing Google's Venice campus, known as the Binoculars Building, for sale through CBRE. The 78,578-square-foot property's triple-net-lease with Google is up for renewal in October 2030. This sale comes after W.P. Carey's 2023 decision to spin off 59 office properties, and follows Google's reversal on its L.A. office expansion last year.",The Real Deal,The Real Deal,0.054261,Neutral,Market Movement
GOOGL,2025-03-25 03:46:53,2025-03-25,2025-03-24,167.07000732421875,168.32000732421875,165.13999938964844,167.67999267578125,290,Youth mental health: Corpus Christi ISD seeks to join lawsuit against social media companies,"Corpus Christi ISD's board of trustees has voted to join an ongoing federal lawsuit against major social media companies, alleging that their platforms contribute to a youth mental health crisis and disrupt the learning environment. The district will only pay legal fees if the lawsuit results in a successful judgment or settlement, aligning with approximately 800 other school districts and 46 Texas school districts awaiting attorney general approval to participate. This action reflects growing concerns from health officials and educators, highlighting issues like addiction, bullying, and the need for increased mental health support in schools due to social media use.",Corpus Christi Caller-Times,Corpus Christi Caller-Times,-0.538278,Bearish,Regulatory/Legal
GOOGL,2025-03-25 03:04:53,2025-03-25,2025-03-24,167.07000732421875,168.32000732421875,165.13999938964844,167.67999267578125,291,"Google's $32B Deal Fuels Cybersecurity Boom: Bet on OKTA, FTNT Stocks","Google's $32 billion acquisition of cloud security firm Wiz signals a major shift in the cybersecurity landscape, highlighting the increasing importance of cloud and AI security. This deal positions cybersecurity companies like Okta (OKTA) and Fortinet (FTNT) for significant growth, as demand for identity security and AI-driven network protection rises. Both companies are rated Zacks Rank #2 (Buy), making them compelling investment opportunities amidst this industry boom.",Nasdaq,Nasdaq,0.225465,Somewhat-Bullish,Merger/Acquisition
GOOGL,2025-03-21 17:39:31,2025-03-21,2025-03-20,161.57000732421875,164.88999938964844,160.9600067138672,162.8000030517578,292,Quest Diagnostics Strikes Generative AI Partnership with Google Cloud,"Quest Diagnostics has partnered with Google Cloud to integrate generative AI capabilities into its services, aiming to enhance predictive population health analytics, customize physician reporting, and improve patient engagement. This collaboration will leverage Google Cloud's AI technologies, such as Google Agentspace, to generate personalized health insights, streamline access to comprehensive laboratory data for clinicians, and boost reporting efficiency through natural-language prompts. The initiative also seeks to uncover subtle patterns in data for faster diagnoses and personalized medicine.",MedCity News,MedCity News,0.578364,Bullish,Product Launch
GOOGL,2025-03-21 03:06:43,2025-03-21,2025-03-20,161.57000732421875,164.88999938964844,160.9600067138672,162.8000030517578,293,Alphabet COA Amie Thuener O’Toole Increases Stock Holdings,"Amie Thuener O’Toole, Alphabet Inc.'s Chief Accounting Officer, has increased her stock holdings through a recent dividend distribution. She received 53 Class C Google Stock Units (GSUs) as dividend-equivalent units (DEUs), which will vest gradually based on continued employment. Following this transaction, O’Toole directly holds a significant number of Class C GSUs and both Class A and Class C shares.",TechGraph,TechGraph,0.341381,Somewhat-Bullish,Leadership Change
GOOGL,2025-03-19 10:45:00,2025-03-19,2025-03-18,163.67999267578125,164.25,156.72000122070312,160.6699981689453,294,Google to set sail in 35-story downtown Austin tower near Lady Bird Lake this year,"Google has confirmed it will finally move into its 35-story sail-shaped tower in downtown Austin this year, after several delays due to the shift to remote and hybrid work environments. The company signed a lease for the entire building overlooking Lady Bird Lake six years ago, and real estate investment trust Cousins Property recently acquired the tower for over $520 million. This move is significant for the Austin office market, which has faced rising vacancy rates, indicating a bullish long-term outlook despite ongoing challenges.",Austin American-Statesman,Austin American-Statesman,0.226589,Somewhat-Bullish,Market Movement
GOOGL,2025-03-18 03:36:02,2025-03-18,2025-03-17,165.02999877929688,166.3000030517578,163.6699981689453,164.2899932861328,295,"NVIDIA, Alphabet and Google Collaborate on the Future of Agentic and Physical AI","NVIDIA, Alphabet, and Google are expanding their collaboration to advance AI, focusing on agentic AI, robotics, and broader accessibility of AI tools. Their joint efforts include optimizing open models like Gemma, developing advanced robotics capabilities through Intrinsic, and applying AI to drug discovery with Isomorphic Labs and grid optimization with X's Tapestry. Google Cloud will also adopt NVIDIA's latest Blackwell GPUs to power these research and production initiatives.",NVIDIA Newsroom,NVIDIA Newsroom,0.816964,Bullish,Product Launch
NVDA,2025-03-31 14:39:58,2025-03-31,2025-03-28,111.48999786376953,112.87000274658203,109.06999969482422,109.66999816894531,297,BOTZ ETF Holdings List — NASDAQ:BOTZ,"This article provides a detailed list of the holdings for the Global X Robotics & Artificial Intelligence ETF (BOTZ) as of March 17, 2026. It includes the symbol, weight percentage, number of shares, and market value for each of the top holdings, with companies like ABB Ltd., NVIDIA Corporation, and Intuitive Surgical, Inc. being prominent. The information is presented to give investors insights into the fund's composition.",TradingView,TradingView,0.100043,Neutral,Other
NVDA,2025-03-31 08:52:49,2025-03-31,2025-03-28,111.48999786376953,112.87000274658203,109.06999969482422,109.66999816894531,298,TOPT ETF Holdings List — AMEX:TOPT,"This article provides a detailed list of the holdings for the iShares Top 20 U.S. Stocks ETF (AMEX:TOPT) as of March 2, 2026. It shows the top companies by weight, including NVIDIA, Apple, Microsoft, Meta Platforms, and Berkshire Hathaway, along with their respective shares and market values. The ETF is composed of major U.S. corporations, offering insights into its investment strategy.",TradingView,TradingView,0.139408,Neutral,Market Movement
NVDA,2025-03-31 05:09:13,2025-03-31,2025-03-28,111.48999786376953,112.87000274658203,109.06999969482422,109.66999816894531,299,Hyperscale Data completes Nvidia GPU cluster installation,"Hyperscale Data has finished installing an Nvidia GPU cluster at its Michigan data center, intended for a new Silicon Valley-based cloud services provider. This move is part of the company's strategy to expand its infrastructure for growing computational demands, with plans to increase the Michigan data center's capacity from 28MW to 340MW. Hyperscale Data, formerly Ault Alliance, is pivoting entirely to AI and data centers, divesting non-data center assets.",Data Center Dynamics,Data Center Dynamics,0.152164,Somewhat-Bullish,Product Launch
NVDA,2025-03-31 02:52:50,2025-03-31,2025-03-28,111.48999786376953,112.87000274658203,109.06999969482422,109.66999816894531,300,NVDL ETF Holdings List — NASDAQ:NVDL,"This article provides the holdings list for the GraniteShares 2x Long NVDA Daily ETF (NVDL) as of March 2, 2026. The ETF's entire composition is in U.S. Dollar (USD), representing 100.00% of its weight with a market value of $4.21 billion. It details the fund's composition by symbol, weight, shares, and market value.",TradingView,TradingView,0.006146,Neutral,Other
NVDA,2025-03-28 00:00:00,2025-03-28,2025-03-27,111.3499984741211,114.44999694824219,110.66000366210938,111.43000030517578,302,CoreWeave Stock Treads Water After Scaled-Back IPO,"CoreWeave, an AI-focused cloud computing company, had a lukewarm IPO, with its stock ending the day at its IPO price of $40 per share, despite initial stumbling. The scaled-back IPO and initial trading performance raise questions about investor appetite for AI stocks amidst a broader tech slump and concerns about CoreWeave's concentrated sales and significant debt. The company's debut is seen as a litmus test for the AI market after Nvidia's recent decline.",Morningstar,Morningstar,-0.058539,Neutral,Market Movement
NVDA,2025-03-27 09:41:00,2025-03-27,2025-03-26,118.7300033569336,118.83999633789062,112.70999908447266,113.76000213623047,303,Is This the Best Artificial Intelligence ETF On the Market You Should Be Buying?,"This article evaluates the Global X Artificial Intelligence & Technology ETF (AIQ) as a top investment option for gaining diversified exposure to the AI megatrend. It highlights AIQ's broad reach across the AI ecosystem, its 15.8% annualized return since 2018, and its holdings beyond just chip manufacturers to include software and data companies like ServiceNow and Snowflake. The ETF is presented as a calculated play on AI's future growth, offering opportunities with less individual stock risk.",24/7 Wall St.,24/7 Wall St.,0.363451,Bullish,Other
NVDA,2025-03-27 06:30:00,2025-03-27,2025-03-26,118.7300033569336,118.83999633789062,112.70999908447266,113.76000213623047,304,Akamai Sharpens Its AI Edge with Launch of Akamai Cloud Inference,"Akamai has launched Akamai Cloud Inference, a new service designed to accelerate AI innovation by enabling faster and more efficient deployment of predictive and large language models. Running on Akamai Cloud, the solution offers significant improvements in throughput and latency, and reduces costs compared to traditional hyperscaler infrastructure. This platform helps businesses perform AI inference closer to the edge, addressing the limitations of centralized cloud models for AI applications.",PR Newswire,PR Newswire,0.371697,Bullish,Product Launch
NVDA,2025-03-27 03:56:58,2025-03-27,2025-03-26,118.7300033569336,118.83999633789062,112.70999908447266,113.76000213623047,305,What does fast food want with Nvidia?,"Yum Brands, parent company of Taco Bell and KFC, has announced a development deal with Nvidia to integrate AI technology into its 61,000 restaurants. This partnership aims to give Yum Brands full control over its data and intellectual property, diverging from its previous reliance on third-party tech partners. The goal is to use Nvidia's tech to process store-level performance, generate personalized action plans for managers, and ultimately enhance efficiency without replacing human workers.",Fast Company,Fast Company,0.305295,Somewhat-Bullish,Product Launch
NVDA,2025-03-27 03:03:49,2025-03-27,2025-03-26,118.7300033569336,118.83999633789062,112.70999908447266,113.76000213623047,306,Torc debuts physical AI for long-haul trucking at NVIDIA GTC 2025,"Torc Robotics announced its collaboration with Flextronics and NVIDIA to develop a scalable physical AI compute system for autonomous long-haul trucks, which was showcased at NVIDIA GTC. This system, featuring NVIDIA DRIVE AGX and Flex's Jupiter platform, is designed to enable self-driving trucks to perceive, understand, and perform complex actions in real-world scenarios at production scale, with a commercial launch planned for 2027. Torc emphasizes that this physical AI is central to its software stack, ensuring safe and efficient autonomous operations.",The Robot Report,The Robot Report,0.386145,Bullish,Product Launch
NVDA,2025-03-27 02:32:21,2025-03-27,2025-03-26,118.7300033569336,118.83999633789062,112.70999908447266,113.76000213623047,307,"Akamai distributes AI inference across the globe, promising lower latency and higher throughput","Akamai Technologies Inc. has launched Akamai Cloud Inference, a new service designed to distribute AI inference closer to users globally, leveraging its highly distributed cloud infrastructure. This aims to reduce latency and increase throughput for AI models, particularly for the operational phase of AI, by moving inference from centralized cloud platforms to the edge. Akamai Cloud Inference offers compute resources including CPUs, GPUs, and ASICs, integrates with Nvidia's AI Enterprise software and Vast Data for advanced data management, and supports containerized workloads and edge compute capabilities.",SiliconANGLE,SiliconANGLE,0.265652,Somewhat-Bullish,Product Launch
NVDA,2025-03-26 15:57:20,2025-03-26,2025-03-25,120.55000305175781,121.29000091552734,118.91999816894531,120.69000244140625,308,"Stock market today: Nasdaq, S&P 500 dive, snap 3-day win streak as Trump preps auto tariffs","US stocks closed lower on Wednesday, snapping a three-day win streak, as President Trump prepared to announce new tariffs on auto imports. The tech-heavy Nasdaq Composite led the losses, falling over 2%, with Nvidia and Tesla shares down more than 5%. The looming tariffs also fueled a surge in copper prices amidst reports of accelerated plans for copper levies.",Yahoo Finance,Yahoo Finance,-0.424752,Bearish,Market Movement
NVDA,2025-03-26 04:58:00,2025-03-26,2025-03-25,120.55000305175781,121.29000091552734,118.91999816894531,120.69000244140625,309,"S&P 500 Gains and Losses Today: Supermicro, Arista Networks, and Nvidia Lead Tech Selloff","The S&P 500 fell 1.1% on Wednesday, March 26, 2025, as a tech selloff led by Super Micro Computer, Arista Networks, and Nvidia, combined with news of potential tariffs on car imports, impacted the market. Super Micro Computer shares plunged after a Goldman Sachs downgrade, while Nvidia stock slipped amid concerns over AI chip sales in China. In contrast, Cintas shares surged after better-than-expected earnings, with Paychex also gaining from its quarterly report, and Dollar Tree rose after announcing the sale of its Family Dollar brand.",Investopedia,Investopedia,-0.409666,Bearish,Market Movement
NVDA,2025-03-26 00:00:00,2025-03-26,2025-03-25,120.55000305175781,121.29000091552734,118.91999816894531,120.69000244140625,310,Advanced Micro Devices Can Double in Price: Here’s Why,"Advanced Micro Devices (AMD) is projected to double in price due to its increasing market share against NVIDIA in GPU and CPU markets, driven by lower-cost, better-performing products. Insider transactions, strong institutional buying, and an undervalued stock price relative to its growth potential support this optimistic outlook. The company is actively addressing its software infrastructure gap to further compete with NVIDIA.",Entrepreneur,Entrepreneur,0.322802,Somewhat-Bullish,Market Movement
NVDA,2025-03-26 00:00:00,2025-03-26,2025-03-25,120.55000305175781,121.29000091552734,118.91999816894531,120.69000244140625,311,Qualcomm Stock Is Coiling for a Breakout,"Qualcomm (NASDAQ: QCOM) is showing signs of an impending breakout, supported by robust technicals, an attractive valuation, and bullish analyst targets. The stock has consistently bounced off its key $150 support level, indicating strong buying interest after recent declines. With diversification efforts in automotive and AI chips paying off, Qualcomm offers significant value compared to its semiconductor peers.",Entrepreneur,Entrepreneur,0.223712,Somewhat-Bullish,Market Movement
NVDA,2025-03-25 03:45:42,2025-03-25,2025-03-24,119.87999725341797,122.22000122070312,119.33999633789062,121.41000366210938,312,Accelerating the Future of Transportation with SES AI’s NVIDIA-Powered Innovation for Electric Vehicles,"SES AI is utilizing NVIDIA hardware and software, including domain-adapted large language models (LLMs) and GPU-accelerated simulations, to rapidly discover new battery materials for electric vehicles. This collaboration has led to significant advancements, such as a 1.6Kx acceleration in simulation workflows, a 25% increase in LLM accuracy, and the identification of 17 candidate materials, resulting in a 20% improvement in battery cycle life. Their approach aims to reduce the time for battery electrolyte discovery from five years to six months, driving sustainable transportation.",NVIDIA Developer,NVIDIA Developer,0.419536,Bullish,Product Launch
NVDA,2025-03-24 21:09:36,2025-03-24,2025-03-21,116.94000244140625,117.98999786376953,115.41999816894531,117.69999694824219,313,4 Best Leveraged ETFs of Last Week,"Last week, the stock market saw moderate gains across major indices, driven by the Fed's decision to hold interest rates steady, NVIDIA's GTC event, and mixed retail sales data. Against this backdrop, several leveraged ETFs performed well, including those focused on energy, uranium, Brazilian stocks, and financials. These ETFs capitalized on the week's market movements, with MicroSectors Energy 3X Leveraged ETNs, Defiance Daily Target 2x Long Uranium ETF, ProShares Ultra MSCI Brazil Capped, and Direxion Daily Financial Bull 3X Shares showing significant gains.",TradingView — Track All Markets,TradingView — Track All Markets,0.33653,Somewhat-Bullish,Market Movement
NVDA,2025-03-24 03:33:01,2025-03-24,2025-03-21,116.94000244140625,117.98999786376953,115.41999816894531,117.69999694824219,314,Is the US Stock Market Cheap Yet?,"The US stock market is currently trading at a 5% discount to its fair value, primarily due to significant selloffs in mega-cap technology and AI stocks. While valuations are more attractive than at the start of the year, they haven't reached the deep discounts seen in 2022. Morningstar strategists advise investors to consider overweighting value and small-cap stocks, and to wait for market stabilization before making major moves.",Morningstar Canada,Morningstar Canada,0.190618,Somewhat-Bullish,Market Movement
NVDA,2025-03-24 03:15:13,2025-03-24,2025-03-21,116.94000244140625,117.98999786376953,115.41999816894531,117.69999694824219,315,Lumentum (LITE) Joins NVIDIA’s AI Photonics Ecosystem for Faster Data Centers,"Lumentum Holdings Inc. (LITE) has joined NVIDIA's AI Photonics Ecosystem, leveraging its high-power, high-efficiency lasers for deployment in NVIDIA Spectrum X Photonics networking switches. This collaboration aims to enhance system resiliency, reduce power consumption, and enable faster AI infrastructure deployments, showcasing the potential of photonic technologies to replace traditional copper interconnects in large-scale AI operations. The article also touches on the growing threat of AI-driven cybercrime and its significant financial impact.",Yahoo Finance,Yahoo Finance,0.390383,Bullish,Product Launch
META,2025-03-31 02:53:22,2025-03-31,2025-03-28,600.3099975585938,601.75,573.9199829101562,576.739990234375,316,"eBay Finally Rolls Out Magical AI Listing Starting In Germany, Plus Updates On Facebook Marketplace Cross Posting","eBay is beginning the rollout of its ""Magical Listing"" AI tool in Germany, allowing sellers to create listings simply by taking a picture, despite being delayed by over a year and a half. The company is also providing updates on its integration with Facebook Marketplace, which has faced challenges with listing visibility. This delayed AI tool places eBay behind competitors like Mercari, Depop, and Poshmark, all of whom have already launched similar features.",Value Added Resource,Value Added Resource,0.140241,Neutral,Product Launch
META,2025-03-25 04:15:00,2025-03-25,2025-03-24,614.969970703125,622.5399780273438,612.2000122070312,618.8499755859375,318,Meta says copying books was 'fair use' in authors' AI lawsuit,"Meta Platforms has argued in a U.S. court that its use of copyrighted books by authors like Ta-Nehisi Coates and Sarah Silverman to train its Llama AI system constitutes ""fair use."" The company is seeking to dismiss a lawsuit filed by the authors who claim Meta used pirated versions of their books without permission. Meta states its AI is transformative, not a substitute for reading the books, while the authors contend Meta systematically took expressive content without compensation.",Reuters,Reuters,-0.204041,Somewhat-Bearish,Regulatory/Legal
META,2025-03-24 03:32:02,2025-03-24,2025-03-21,583.4199829101562,597.5399780273438,580.9500122070312,596.25,319,What Do DEI Rollbacks Mean for Investors?,"Recent DEI rollbacks by major U.S. companies, influenced by a 2025 executive order, are raising concerns among investors regarding potential impacts on corporate environmental, social, and governance (ESG) risks. While not all changes are equally material, those affecting core initiatives, particularly in knowledge-intensive industries, could modestly increase human capital and overall ESG risk scores. Morningstar Sustainalytics analyzes these changes by focusing on their relevance to workforce diversity assessments and their weight within ESG risk ratings.",Morningstar,Morningstar,0.10841,Neutral,Regulatory/Legal
META,2025-03-19 03:31:21,2025-03-19,2025-03-18,600.0499877929688,600.25,574.6599731445312,582.3599853515625,320,Magnificent 7 Stocks Are Falling: How Low Can They Go?,"The author discusses the current downturn in the Magnificent 7 stocks, viewing it as a market correction rather than a crash, with most stocks trading 20-25% off their all-time highs. He analyzes the technical indicators of the Roundhill Magnificent Seven ETF (MAGS) and provides specific insights and support levels for Meta Platforms (META), Alphabet (GOOG), and Microsoft (MSFT), highlighting potential buy opportunities.",Dr Wealth,Dr Wealth,0.047878,Neutral,Market Movement
META,2025-03-17 03:49:36,2025-03-17,2025-03-14,602.7999877929688,608.8599853515625,594.780029296875,607.5999755859375,321,When Facebook Ads Won’t Help Performance Advertisers,"This article discusses when Facebook ads are beneficial for performance advertisers and when they may not be. While Facebook offers extensive targeting and can drive traffic, marketers should be aware of diminishing returns due to factors like inappropriate budgets, ad frequency fatigue, rising CPA, and audience demographics. The piece emphasizes the importance of a diversified media mix and exploring alternative advertising channels for sustainable growth.",Taboola.com,Taboola.com,0.070263,Neutral,Product Launch
META,2025-03-14 03:32:02,2025-03-14,2025-03-13,620.25,620.5,586.510009765625,590.6400146484375,322,Why Meta’s New Content Moderation Policy Could Pose Risks to Its Stock,"Meta's new content moderation policy, shifting from third-party fact-checking to a user-led community notes approach, poses significant risks to the company's stock. This change could increase the spread of misinformation and hate speech, potentially leading to heightened regulatory scrutiny, especially from European bodies like the EU Digital Services Act, and financial repercussions such as reduced user engagement and advertiser spending due to brand safety concerns. While Meta's reliance on small and medium-sized businesses for advertising might offer some insulation compared to platforms like X, the potential for substantial fines and a challenging regulatory landscape globally are key concerns for investors.",Morningstar,Morningstar,-0.420292,Bearish,Regulatory/Legal
META,2025-03-13 19:45:00,2025-03-13,2025-03-12,629.9000244140625,633.3300170898438,609.3499755859375,619.5599975585938,323,"Stock Market Today: Dow Sinks 537 Points On Tariff Threats As S&P 500 Corrects; Gold Miners Jump, Meta Triggers Sell Rule (Live Coverage)","The Dow Jones Industrial Average fell 537 points, and the S&P 500 corrected amid new tariff threats from the Trump administration. Gold miners rallied while Home Depot and Meta Platforms experienced sell-offs, with Meta triggering a sell rule. Despite a late attempt by traders to cover short positions, major indexes ended the trading day lower.",Investor's Business Daily,Investor's Business Daily,-0.101609,Neutral,Market Movement
META,2025-03-12 10:31:00,2025-03-12,2025-03-11,595.0499877929688,614.9299926757812,593.3300170898438,605.7100219726562,324,Meta Faces Legal Challenge by French Publishers Over AI Training,"French publishers and authors have collectively filed a lawsuit against Meta Platforms Inc., alleging copyright infringement. The complaint, lodged by several leading French publishing and authors' associations, claims that Meta utilized their copyrighted literary works without permission to train its generative artificial intelligence models. This legal action targets Meta in a Paris intellectual property court.",Bloomberg.com,Bloomberg.com,-0.436695,Bearish,Regulatory/Legal
META,2025-03-12 00:00:00,2025-03-12,2025-03-11,595.0499877929688,614.9299926757812,593.3300170898438,605.7100219726562,325,Is it time to buy the Magnificent Seven?,"The ""Magnificent Seven"" tech stocks have experienced a significant selloff, making some of them appear undervalued according to Morningstar's fair value metrics. While Meta, Amazon, Microsoft, and Alphabet are now rated as buys, Nvidia and Tesla are fairly valued, and Apple remains overvalued. Morningstar strategists still recommend underweighting growth stocks overall, favoring value stocks due to market volatility and slowing economic growth.",Morningstar,Morningstar,0.278774,Somewhat-Bullish,Market Movement
