ticker,time_published,news_date,price_date,Open,High,Low,Close,_1,title,summary,source,source_domain,overall_sentiment_score,overall_sentiment_label,event_label
META,2025-03-11 00:00:00,2025-03-11,2025-03-10,608.0700073242188,610.1099853515625,586.8699951171875,597.989990234375,326,"Market outlook: How investors with US shares should respond to tariffs, uncertainty in March","This article advises investors with US shares to focus on fundamentals and valuations amid the uncertainty of potential tariffs in March 2025. It suggests overweighting value and small-cap stocks, while underweighting growth stocks and certain large-cap stocks. The author also predicts potential negative impacts of tariffs on several sectors and companies, highlighting the importance of strategic portfolio positioning.",Morningstar,Morningstar,0.067166,Neutral,Market Movement
META,2025-03-07 16:51:00,2025-03-07,2025-03-06,648.0,650.5599975585938,624.1099853515625,627.9299926757812,327,Advocates want light shed on power plans for Meta’s Louisiana data center,"Environmental and consumer protection advocates are demanding transparency from Meta and Entergy regarding the power plans for Meta's new data center in Louisiana. They want Meta and its developer, Laidley LLC, to be listed as parties on Entergy's application to build three natural gas power plants, which would require disclosure of energy demand and job creation figures. Advocates are concerned about the $3 billion cost being passed to ratepayers and are pushing back against Entergy's request for expedited permitting.",Louisiana Illuminator,Louisiana Illuminator,-0.059308,Neutral,Regulatory/Legal
META,2025-03-07 14:10:00,2025-03-07,2025-03-06,648.0,650.5599975585938,624.1099853515625,627.9299926757812,328,"Is Meta Platforms Stock a Buy, Sell, or Hold Ahead of Llama 4 Launch?","Meta Platforms (META) is preparing to launch its Llama 4 AI model in April 2025, which is expected to enhance its competitive position in generative AI. The company recently reported strong Q4 2024 earnings, significantly beating revenue and EPS expectations. Analysts widely rate META as a ""Strong Buy,"" with a considerable upside potential indicated by their price targets.",Barchart.com,Barchart.com,0.27938,Somewhat-Bullish,Product Launch
META,2025-03-07 10:32:00,2025-03-07,2025-03-06,648.0,650.5599975585938,624.1099853515625,627.9299926757812,329,Why Arista Networks Inc (ANET) Is Plunging So Far in 2025?,"Arista Networks Inc (ANET) is experiencing a significant stock plunge in 2025, primarily due to a substantial drop in revenue from Meta Platforms, one of its largest customers. The market is broadly seeing a cooling-off period, with big-cap stocks leading the decline amidst tariff and AI-related fears. Despite the downturn, the article suggests that ANET might offer a buying opportunity, although other AI stocks are considered to have greater short-term promise.",Insider Monkey,Insider Monkey,0.033135,Neutral,Market Movement
META,2025-03-06 08:59:00,2025-03-06,2025-03-05,641.0,659.5,637.6599731445312,656.469970703125,330,Salesforce joins growing list of companies ending diversity hiring initiatives,"Salesforce Inc. has become the latest company to end its diversity hiring initiatives, removing language about diversity and inclusion from its annual financial disclosure. This decision follows executive orders signed by President Donald Trump targeting the elimination of DEI programs. Other major companies like Google, Meta, Target, Amazon, Walmart, and Deloitte have also rolled back similar initiatives.",KRON4,KRON4,-0.090313,Neutral,Regulatory/Legal
META,2025-03-06 03:31:54,2025-03-06,2025-03-05,641.0,659.5,637.6599731445312,656.469970703125,331,Hot Stocks from 2024 Have Grown Cold,"Many of 2024's top-performing stocks, particularly in the AI sector, have seen significant declines in early 2025 after being overvalued. While these stocks stumbled due to various negative news events and market corrections, healthcare stocks have seen notable gains and are leading the market in 2025. This shift highlights a return to fairer valuations for some previously inflated growth stocks and a rotation into defensive sectors.",Morningstar,Morningstar,-0.102029,Neutral,Market Movement
TSLA,2025-03-31 11:39:50,2025-03-31,2025-03-28,275.5799865722656,276.1000061035156,260.57000732421875,263.54998779296875,332,TSLL ETF Holdings List — NASDAQ:TSLL,"The article provides the holdings list for the Direxion Daily TSLA Bull 2X ETF (TSLL) as of March 17, 2026. The fund composition shows U.S. Dollar at 91.43% and Tesla, Inc. (TSLA) at 8.57% of its market value. The ETF is listed on the Nasdaq Stock Market.",TradingView,TradingView,0.024613,Neutral,Market Movement
TSLA,2025-03-31 03:14:37,2025-03-31,2025-03-28,275.5799865722656,276.1000061035156,260.57000732421875,263.54998779296875,333,Tesla Challenges Lucid For EV Sales In…Saudi Arabia?,"Tesla is re-entering the Saudi Arabian EV market to boost its sales, despite the country traditionally being a tough market for electric vehicles. This move places Tesla in direct competition with Lucid, which has a significant financial stake and operational presence in Saudi Arabia through its Public Investment Fund backing and a newly established manufacturing plant. The competition is intensifying as Saudi Arabia aims for 30% of new car sales to be electric by 2030, with both companies vying for market share amidst a growing interest in zero-emission mobility.",CleanTechnica,CleanTechnica,0.197447,Somewhat-Bullish,Product Launch
TSLA,2025-03-31 02:09:50,2025-03-31,2025-03-28,275.5799865722656,276.1000061035156,260.57000732421875,263.54998779296875,334,ARKQ ETF Holdings List — CBOE:ARKQ,"This article provides the ARK Autonomous Technology & Robotics ETF (ARKQ) holdings list as of March 19, 2026. It details the top holdings including Tesla, Inc., Teradyne, Inc., and Kratos Defense & Security Solutions, Inc., along with their respective weights, shares, and market values. The data offers insights into the fund's composition focusing on autonomous technology and robotics companies.",TradingView,TradingView,0.109413,Neutral,Other
TSLA,2025-03-28 22:09:18,2025-03-28,2025-03-27,272.4800109863281,291.8500061035156,271.82000732421875,273.1300048828125,335,Simplify Volt TSLA Revolution ETF (TESL) Dividend Yield 2026 & History $TESL,"The Simplify Volt TSLA Revolution ETF (TESL) currently offers an annual dividend of $7.87 per share, resulting in a dividend yield of 56.17%. The most recent dividend payment was $0.15 per share, paid on March 31, 2025. Investors can review TESL's dividend history, compare its performance against other ETFs, and access various dividend-related tools and resources on MarketBeat.",MarketBeat,MarketBeat,0.442829,Bullish,Other
TSLA,2025-03-28 15:23:00,2025-03-28,2025-03-27,272.4800109863281,291.8500061035156,271.82000732421875,273.1300048828125,336,The anti-Trump movement has found its target: Elon Musk’s Tesla,"The anti-Trump movement has shifted its focus to Elon Musk and his company, Tesla. Activists like Jennifer Cousins, who previously opposed Donald Trump's policies, now view Musk as a greater threat to democracy and are organizing events to target his company. A recent anti-Tesla rally in Central Florida drew about 100 people, with the stated goal of bankrupting Musk.",The Detroit News,The Detroit News,-0.628228,Bearish,Regulatory/Legal
TSLA,2025-03-28 03:55:38,2025-03-28,2025-03-27,272.4800109863281,291.8500061035156,271.82000732421875,273.1300048828125,337,Changes in Delaware corporate law: A D&O liability and insurance perspective,"Delaware has adopted Senate Bill 21 (SB 21) to modify its corporate laws, aiming to reduce shareholder rights in claims involving controlling stockholders and conflicted transactions. This move is intended to mitigate the risk of companies re-incorporating in other states with more corporation-friendly laws. The changes are expected to ease D&O liabilities for Delaware corporations, potentially reducing D&O insurance premiums, though it does not affect federal securities laws or liabilities in other states.",www.wtwco.com,www.wtwco.com,0.052099,Neutral,Regulatory/Legal
TSLA,2025-03-28 03:44:32,2025-03-28,2025-03-27,272.4800109863281,291.8500061035156,271.82000732421875,273.1300048828125,338,Electric Semi Trucks: 7 Promising Insights in Freight Evolution,"Electric semi-trucks are transitioning from pilot programs to mainstream logistics, with companies like Saia testing Tesla Semis and reporting benefits like smoother acceleration and reduced operating costs. While challenges such as charging infrastructure and battery fire risks exist, incentives and regulatory mandates are accelerating EV adoption. The article details operational efficiencies, cost comparisons with diesel trucks, and regional variations in adoption, highlighting the potential for electric semis to become standard in freight operations.",Tank Transport,Tank Transport,0.147211,Neutral,Product Launch
TSLA,2025-03-27 09:15:00,2025-03-27,2025-03-26,282.6600036621094,284.8999938964844,266.510009765625,272.05999755859375,339,Is Cathy Wood’s ARKK ETF a Safe Investment?,"This article analyzes the ARK Innovation ETF (ARKK) managed by Cathy Wood, focusing on its safety as an investment. It highlights ARKK's high volatility, significant concentration in tech stocks and a few specific holdings like Tesla, and a relatively high expense ratio with no dividends. The author suggests that despite the potential for disruptive innovation, ARKK's lack of diversification and past performance indicate it may not be a safe choice for risk-averse investors.",24/7 Wall St.,24/7 Wall St.,-0.134933,Neutral,Market Movement
TSLA,2025-03-26 07:00:00,2025-03-26,2025-03-25,283.6000061035156,288.20001220703125,271.2799987792969,288.1400146484375,340,"Best of Both Worlds: 3 ETFs With High Dividend Yields, Low Fees","This article highlights three exchange-traded funds (ETFs) that combine high dividend yields with relatively low fees, catering to investors seeking passive income alongside potential capital appreciation. It features the YieldMax Ultra Option Income Strategy ETF (ULTY) for its high yield through a covered call strategy, the YieldMax Short TSLA Option Income Strategy ETF (CRSH) for its short exposure to Tesla and significant distributions, and the ProShares Bitcoin Strategy ETF (BITO) for its Bitcoin-linked strategy and compelling dividend yield. The article emphasizes the unique and often complex strategies these ETFs employ to achieve their high yields, while also noting the associated risks.",Finviz,Finviz,0.014043,Neutral,Product Launch
TSLA,2025-03-21 03:51:22,2025-03-21,2025-03-20,233.35000610351562,238.0,230.0500030517578,236.25999450683594,341,CII Updates Reincorporation & Shareholder Voting Rights Policies,"The Council of Institutional Investors (CII) has updated its policies regarding corporate governance, specifically focusing on reincorporation and shareholder voting rights. The amendments address concerns about companies reincorporating into jurisdictions with weaker governance and the use of ""stealth"" dual-class share structures that misalign voting rights with economic ownership. These changes aim to protect minority shareholders and promote stronger corporate accountability.",Minerva-Manifest,Minerva-Manifest,-0.187184,Somewhat-Bearish,Regulatory/Legal
TSLA,2025-03-20 16:05:00,2025-03-20,2025-03-19,231.61000061035156,241.41000366210938,229.1999969482422,235.86000061035156,342,Xcel Energy to Deploy Advanced Virtual Power Plant in Colorado with Itron and Tesla,"Xcel Energy is partnering with Itron and Tesla to deploy an advanced virtual power plant (VPP) in Colorado. This initiative integrates Itron's IntelliFLEX Aggregator DERMS solution with Tesla Home Batteries to enhance grid flexibility, visibility, and control. The collaboration aims to expand Xcel Energy’s Renewable Battery Connect program, leveraging residential batteries to stabilize the electric grid during peak energy demand and advance electrification goals.",GlobeNewswire,GlobeNewswire,0.379082,Bullish,Product Launch
TSLA,2025-03-20 14:09:35,2025-03-20,2025-03-19,231.61000061035156,241.41000366210938,229.1999969482422,235.86000061035156,343,Was Tesla key to ESG outperformance last year?,"In 2020, sustainable US stock funds significantly outperformed the broader market, largely due to their focus on high-performing technology stocks like Tesla and Nvidia, and their avoidance of energy companies. This article examines the drivers behind the top-performing diversified US sustainable funds, highlighting how holdings in companies such as Tesla, Moderna, and various solar energy firms contributed to exceptional returns, with many funds achieving over 35% growth. Both active and index-based ESG funds benefited from overweighting tech and renewable energy sectors.",Morningstar Australia,Morningstar Australia,0.407186,Bullish,Market Movement
TSLA,2025-03-20 03:51:32,2025-03-20,2025-03-19,231.61000061035156,241.41000366210938,229.1999969482422,235.86000061035156,344,"Tesla Cybertruck recalled eighth time, exterior body panels can fall off","The Tesla Cybertruck has been recalled for the eighth time due to issues with its stainless steel exterior. Specifically, the cant rail trim pieces can detach, posing a hazard to other road users, a problem Tesla plans to fix using a different structural adhesive and a stud-welded reinforcement. Despite multiple recalls for various issues including accelerator pedals and inverter faults, Tesla reports no collisions or injuries related to this particular defect.",Green Car Reports,Green Car Reports,-0.534652,Bearish,Regulatory/Legal
TSLA,2025-03-19 00:00:00,2025-03-19,2025-03-18,228.16000366210938,230.10000610351562,222.27999877929688,225.30999755859375,345,"Tesla gets permit to ferry passengers in California, a stepping stone toward autonomous taxis","Tesla Inc. has received a permit from California regulators to start a charter service using company-employed drivers to transport its employees. This step is seen as groundwork for its future plans for driverless Tesla taxis, although the permit does not currently allow for public rideshare or driverless operations. The company plans to launch driverless vehicles in Austin, Texas, in June, while full public deployment in California would require further regulatory approvals.",CalMatters,CalMatters,0.240066,Somewhat-Bullish,Regulatory/Legal
TSLA,2025-03-18 02:37:01,2025-03-18,2025-03-17,245.05999755859375,245.39999389648438,232.8000030517578,238.00999450683594,346,America's Best And Worst EV Charging Networks: These Fail Half The Time,"A Consumer Reports study revealed significant reliability issues with various EV charging networks in the U.S., with Shell Recharge and EVgo failing nearly half the time. Tesla Superchargers and the Rivian Adventure Network demonstrated the highest reliability. Problems often stemmed from glitchy payment systems, broken hardware, and slow charging speeds, highlighting the need for better integration and accountability among charging providers.",InsideEVs,InsideEVs,0.026186,Neutral,Product Launch
TSLA,2025-03-17 11:10:00,2025-03-17,2025-03-14,247.30999755859375,251.5800018310547,240.72999572753906,249.97999572753906,347,Tesla launches free trial of assisted driving service in China,"Tesla is offering a free trial of its Full Self-Driving (FSD) service in China from March 17 to April 16. This initiative aims to expand FSD's reach in the country, with Tesla collaborating with Baidu to enhance the system's performance. Unlike in the U.S., Tesla faces data localization challenges in China which limit its ability to train the FSD system using local EV data.",Reuters,Reuters,0.182505,Somewhat-Bullish,Product Launch
JPM,2025-03-31 03:12:44,2025-03-31,2025-03-28,246.94000244140625,249.50999450683594,241.11000061035156,242.85000610351562,348,Climate Intuition: The future of homeowners insurance,"J.P. Morgan's ""Climate Intuition"" report examines the critical state of the homeowners insurance market, highlighting increasing premiums due to inflation, climate change, and varied state regulations. Dr. Sarah Kapnick, Global Head of Climate Advisory, explains that these issues necessitate investment in resilience, financial innovation, and regulatory action to maintain insurer profitability. The report explores how these factors influence insurance costs and market dynamics, offering insights into potential solutions.",J.P. Morgan,J.P. Morgan,0.30596,Somewhat-Bullish,Other
JPM,2025-03-31 03:01:28,2025-03-31,2025-03-28,246.94000244140625,249.50999450683594,241.11000061035156,242.85000610351562,349,"Raymond James, Equitable welcome breakaways from Morgan Stanley, JPMorgan","Raymond James and Equitable have successfully recruited experienced advisors from Morgan Stanley and JPMorgan, respectively, as part of an ongoing trend of advisors departing wirehouses. Raymond James & Associates welcomed Jefferey Biederman Jr. and Andrew Burns, who managed over $465 million at Morgan Stanley, to their employee advisor arm in West Virginia. Separately, Equitable Advisors added Shebna Olsen–Shillibeer, who oversaw approximately $180 million at JPMorgan Wealth Management, to their New York City office.",InvestmentNews,InvestmentNews,0.073361,Neutral,Market Movement
JPM,2025-03-27 21:20:00,2025-03-27,2025-03-26,252.60000610351562,254.6699981689453,249.77999877929688,251.02999877929688,353,"British giant Barclays to set up brokerage firm in Türkiye, marking return to market","Barclays Bank PLC has received authorization from Türkiye’s Capital Markets Board (CMB) to establish a new brokerage firm, Barclays Securities Inc., marking its return to the Turkish market. This move is seen as a positive development, especially since the CMB has been encouraging the creation of new brokerage firms. The CMB had previously approved similar ventures by Aktif Bank Inc. and Fibabanka Inc.",Türkiye Today,Türkiye Today,0.525855,Bullish,Merger/Acquisition
JPM,2025-03-27 03:55:02,2025-03-27,2025-03-26,252.60000610351562,254.6699981689453,249.77999877929688,251.02999877929688,354,"Drummond scores victory for consumer choice, corporate accountability","Attorney General Gentner Drummond and 14 other state attorneys general have successfully concluded their investigation into Wells Fargo, leading the bank to abandon its Environmental Social Governance (ESG) policies and its membership in the Net-Zero Banking Alliance. The coalition had been investigating six major American banks for potential antitrust or consumer protection violations due to their net-zero emissions policies and financing restrictions. The investigation continues for the remaining five banks, with Drummond emphasizing holding them accountable for any wrongdoing.",oklahoma.gov,oklahoma.gov,0.337114,Somewhat-Bullish,Regulatory/Legal
JPM,2025-03-26 12:00:00,2025-03-26,2025-03-25,249.30999755859375,251.82000732421875,247.6199951171875,251.1300048828125,355,"J.P. Morgan Real Estate Income Trust, Inc. Expands Portfolio with Acquisitions of Two Attainable Housing Assets","J.P. Morgan Real Estate Income Trust, Inc. (JPMREIT) announced the acquisition of two attainable housing assets: The Preserve at Pine Valley in Wilmington, NC ($32.1 million) and Bass Lofts in Atlanta, GA ($34.8 million). These acquisitions align with JPMREIT's strategy to invest in high-quality residential properties in high-growth markets, leveraging strong demand for rental housing in the Sunbelt region. This expands JPMREIT's total portfolio to 12 investments in the residential sector.",PR Newswire,PR Newswire,0.232508,Somewhat-Bullish,Merger/Acquisition
JPM,2025-03-26 02:33:03,2025-03-26,2025-03-25,249.30999755859375,251.82000732421875,247.6199951171875,251.1300048828125,356,"JPMorganChase, Quantinuum, Argonne National Laboratory, Oak Ridge National Laboratory and University of Texas at Austin advance the application of quantum computing to potential real-world use cases beyond the capabilities of classical computing","A joint research team, including JPMorganChase and Quantinuum, has achieved a quantum computing milestone by demonstrating a novel protocol to generate Certified Quantum Randomness. This breakthrough, published in Nature, utilizes the 56-qubit Quantinuum System Model H2 to perform a task previously unachievable by classical computation, proving a real-world application of quantum computing beyond classical supercomputer capabilities. The Certified Randomness generated has significant implications for cryptography, statistical sampling, and numerical simulations.",J.P. Morgan,J.P. Morgan,0.246568,Somewhat-Bullish,Product Launch
JPM,2025-03-25 22:52:27,2025-03-25,2025-03-24,245.47999572753906,248.69000244140625,244.41000366210938,248.05999755859375,357,JAVA Stock Fund Price and Chart — TSX:JAVA,"This article provides a comprehensive overview of the JPMorgan US Value Active ETF Trust Units (TSX:JAVA), including its current price, NAV, AUM, and performance metrics. It details the fund's investment strategy, classification, and top holdings, and addresses frequently asked questions regarding ETFs and JAVA's specifics. Technical analysis and seasonal trends are also mentioned to offer insights into potential future movements.",TradingView,TradingView,0.127506,Neutral,Market Movement
JPM,2025-03-24 22:11:01,2025-03-24,2025-03-21,237.80999755859375,242.3000030517578,236.5,241.6300048828125,358,"United Airlines And JPMorgan Roll Out Exclusive Benefits For New MileagePlus Cardholders, Including Welcome Bonuses","United Airlines and JPMorgan Chase & Co. have introduced new benefits and welcome bonuses for their MileagePlus cardholders. These enhancements aim to make flying more rewarding and personalized, offering significant value and opportunities to earn Premier qualifying points. The new offerings cater to various traveler preferences, with benefits ranging from $800 to $2,000 annually and welcome bonuses of 80,000 to 125,000 miles.",Sahm,Sahm,0.270159,Somewhat-Bullish,Product Launch
JPM,2025-03-21 18:09:12,2025-03-21,2025-03-20,236.55999755859375,241.75999450683594,236.1999969482422,239.00999450683594,359,J.P. Morgan revives short volatility play with new ETN,"J.P. Morgan has launched a new exchange-traded note (ETN), VYLD, which offers inverse exposure to the S&P VIX short-term futures, a product structure not seen in the US ETN market since 2018. The ETN, priced on March 19, 2025, and issued by J.P. Morgan Chase Financial Co., is listed on NYSE Arca. This move indicates client interest in volatility-selling strategies and marks J.P. Morgan's second ETN listing as the largest structured note issuer in the US.",Structured Retail Products,Structured Retail Products,0.034304,Neutral,Product Launch
JPM,2025-03-21 13:39:00,2025-03-21,2025-03-20,236.55999755859375,241.75999450683594,236.1999969482422,239.00999450683594,360,Exclusive: JPMorgan asset management unit quits industry climate coalition,"JPMorgan Chase & Co's asset management unit has withdrawn from the Net Zero Asset Managers (NZAM) initiative, citing recent developments in the regulatory environment and client expectations. This exit marks another blow to the climate coalition, which had paused its operations in January amid political pressures from U.S. Republicans and the departure of other major players like BlackRock. The NZAM group was launched in December 2020 to align the global fund management industry with climate goals.",Reuters,Reuters,-0.378267,Bearish,Regulatory/Legal
JPM,2025-03-21 05:09:25,2025-03-21,2025-03-20,236.55999755859375,241.75999450683594,236.1999969482422,239.00999450683594,361,Product and Service Launches,"This article details several new product and service launches in the retirement and investment sectors. Key announcements include October Three's expansion of its O3 PRIME retirement plan, the launch of JPMorgan's U.S. Research Enhanced Large-Cap ETF, and BlackRock's new iShares Managed Futures Active ETF. Additionally, PensionBee has added Roth and contribution capabilities to its mobile app, SMArtX Advisory Solutions expanded its Manager Marketplace, and ARS selected SS&C to support its guaranteed income products.",plansponsor,plansponsor,0.223775,Somewhat-Bullish,Product Launch
V,2025-03-21 19:16:00,2025-03-21,2025-03-20,339.0,342.239990234375,337.6600036621094,339.5,362,Shark Tank’s Anupam Mittal to NPCI: Time to disrupt companies like Visa and MasterCard with UPI,"Anupam Mittal, judge on Shark Tank India, advocates for leveraging India's UPI system to challenge global payment giants like Visa and Mastercard, citing its costless transactions. He urges the National Payments Corporation of India (NPCI) to push UPI's global expansion. Meanwhile, NPCI is working to mitigate fraud by restricting the 'Collect Payments' feature.",Times of India,Times of India,-0.641909,Bearish,Other
V,2025-03-14 17:14:00,2025-03-14,2025-03-13,330.989990234375,336.20001220703125,327.70001220703125,328.54998779296875,363,Visa’s chief risk officer Paul Fabara sells $12.9 million in stock,"Paul Fabara, Visa's Chief Risk and Client Services Officer, sold 39,350 shares of Visa's Class A common stock for approximately $12.9 million after exercising stock options. Following these transactions, Fabara now directly holds 26,413 shares. The company has also been actively fighting fraud, preventing over $350 million in scam attempts with analyst ratings remaining largely positive.",Investing.com,Investing.com,0.118297,Neutral,Leadership Change
